{"arm":{"authorization_quorum":4,"family":"appss","holders":[1,2,3],"k":2,"n":3,"policy_id":"LOCUS-canonical-email-set-v1","result_id":"LOCUS-managed-flow-result-appss-v1","suite_id":"LOCUS-APPSS-2HASHDH-RISTRETTO255-SHA512-GF128-v1","topology_id":"LOCUS-paired-suite-deployment-2of3-v1"},"arm_id":"appss-2of3","bindings":{"collected_at_utc":"2026-08-17T11:22:51+00:00","compose_sha256":"923b39d36db0922ee934da4c3e56d9cd457ca4ffb19437459af434c451dfef85","host_tier":"same-host-single-operator","image_id":"sha256:c163fb6ad3545ae8b6670a2923ccceb427f374817a7c6f45b16d778f33473580","live_graph_sha256":"e198cf490b867c207c3e22cc872d32fbcdd3f5d1f4a81481a451d5d2b62dad4e","lockfile_sha256":"4fbd85bc3c1c96cd95929e645294b44b521023f3329fdd00d13466c29ee0f29c","managed_manifest_sha256":"f27b370a746b8d9107fb96a40719d721060e81855f0669cbc3febbeae9953185","pseudonymous_client_set_id":"clients-0121ab56858c0566","pseudonymous_host_id":"host-7b356ac77ed99a2f","pseudonymous_package_set_id":"packages-e60c7dca1b6c416a","pseudonymous_project_id":"project-b71600b7e821c6d4","resolved_graph_sha256":"c3bec6a38f1618dcdfc7b15386eac1f1d92a6fc3205664b862d1649a0a6b8b8f","source_commit":"cd5aaaf762a9b18bef681f496f704f772fe6e9be","source_tree_sha256":"45bd270d7b1f67fcacc82fc617db08879fb2aecefa3166846151cb9423cce554"},"cleanup":{"complete":true,"raw_observations_discarded":true},"contacts":[{"category":"package-import","receiver_role":"managed-client","reconciliation":"matched","rejected_count":1,"request_body_bytes":19348,"request_count":2,"response_body_bytes":675,"sender_role":"browser","success_count":1,"unavailable_count":0},{"category":"recover","receiver_role":"managed-client","reconciliation":"matched","rejected_count":1,"request_body_bytes":367,"request_count":2,"response_body_bytes":621,"sender_role":"browser","success_count":1,"unavailable_count":0},{"category":"container-action","receiver_role":"manager-ui","reconciliation":"matched","rejected_count":0,"request_body_bytes":473,"request_count":3,"response_body_bytes":242,"sender_role":"browser","success_count":3,"unavailable_count":0},{"category":"manager-status","receiver_role":"manager-ui","reconciliation":"matched","rejected_count":0,"request_body_bytes":0,"request_count":3,"response_body_bytes":11717,"sender_role":"browser","success_count":3,"unavailable_count":0},{"category":"admission-issue","receiver_role":"admission","reconciliation":"matched","rejected_count":0,"request_body_bytes":5494,"request_count":8,"response_body_bytes":15908,"sender_role":"managed-client","success_count":8,"unavailable_count":0},{"category":"discovery-read","receiver_role":"operator","reconciliation":"matched","rejected_count":0,"request_body_bytes":296,"request_count":4,"response_body_bytes":1640,"sender_role":"managed-client","success_count":4,"unavailable_count":0},{"category":"appss-evaluate","receiver_role":"party","reconciliation":"matched","rejected_count":0,"request_body_bytes":1702,"request_count":1,"response_body_bytes":2066,"sender_role":"managed-client","success_count":1,"unavailable_count":0},{"category":"appss-evaluate","receiver_role":"party","reconciliation":"matched","rejected_count":0,"request_body_bytes":1702,"request_count":1,"response_body_bytes":2066,"sender_role":"managed-client","success_count":1,"unavailable_count":0},{"category":"authorize","receiver_role":"party","reconciliation":"matched","rejected_count":0,"request_body_bytes":3867,"request_count":1,"response_body_bytes":119,"sender_role":"managed-client","success_count":1,"unavailable_count":0},{"category":"authorize","receiver_role":"party","reconciliation":"matched","rejected_count":0,"request_body_bytes":3867,"request_count":1,"response_body_bytes":119,"sender_role":"managed-client","success_count":1,"unavailable_count":0},{"category":"authorize","receiver_role":"party","reconciliation":"matched","rejected_count":0,"request_body_bytes":3867,"request_count":1,"response_body_bytes":119,"sender_role":"managed-client","success_count":1,"unavailable_count":0},{"category":"authorize","receiver_role":"party","reconciliation":"matched","rejected_count":0,"request_body_bytes":3867,"request_count":1,"response_body_bytes":119,"sender_role":"managed-client","success_count":1,"unavailable_count":0},{"category":"authorize","receiver_role":"party","reconciliation":"matched","rejected_count":0,"request_body_bytes":3867,"request_count":1,"response_body_bytes":0,"sender_role":"managed-client","success_count":0,"unavailable_count":1},{"category":"current-read","receiver_role":"party","reconciliation":"matched","rejected_count":0,"request_body_bytes":174,"request_count":3,"response_body_bytes":5436,"sender_role":"managed-client","success_count":3,"unavailable_count":0},{"category":"current-read","receiver_role":"party","reconciliation":"matched","rejected_count":0,"request_body_bytes":174,"request_count":3,"response_body_bytes":5436,"sender_role":"managed-client","success_count":3,"unavailable_count":0},{"category":"current-read","receiver_role":"party","reconciliation":"matched","rejected_count":0,"request_body_bytes":174,"request_count":3,"response_body_bytes":5436,"sender_role":"managed-client","success_count":3,"unavailable_count":0},{"category":"current-read","receiver_role":"party","reconciliation":"matched","rejected_count":0,"request_body_bytes":174,"request_count":3,"response_body_bytes":3624,"sender_role":"managed-client","success_count":2,"unavailable_count":1},{"category":"current-read","receiver_role":"party","reconciliation":"matched","rejected_count":0,"request_body_bytes":174,"request_count":3,"response_body_bytes":0,"sender_role":"managed-client","success_count":0,"unavailable_count":3},{"category":"storage-execute","receiver_role":"storage-gateway","reconciliation":"matched","rejected_count":0,"request_body_bytes":30857,"request_count":7,"response_body_bytes":43624,"sender_role":"managed-client","success_count":6,"unavailable_count":1},{"category":"container-inspect","receiver_role":"docker-engine","reconciliation":"fixed-available","rejected_count":0,"request_body_bytes":0,"request_count":3,"response_body_bytes":23610,"sender_role":"manager-controller","success_count":3,"unavailable_count":0},{"category":"container-list","receiver_role":"docker-engine","reconciliation":"fixed-available","rejected_count":0,"request_body_bytes":0,"request_count":9,"response_body_bytes":230380,"sender_role":"manager-controller","success_count":9,"unavailable_count":0},{"category":"container-stop","receiver_role":"docker-engine","reconciliation":"fixed-available","rejected_count":0,"request_body_bytes":0,"request_count":3,"response_body_bytes":0,"sender_role":"manager-controller","success_count":3,"unavailable_count":0},{"category":"container-action","receiver_role":"manager-controller","reconciliation":"matched","rejected_count":0,"request_body_bytes":473,"request_count":3,"response_body_bytes":242,"sender_role":"manager-ui","success_count":3,"unavailable_count":0},{"category":"manager-status","receiver_role":"manager-controller","reconciliation":"matched","rejected_count":0,"request_body_bytes":6,"request_count":3,"response_body_bytes":11717,"sender_role":"manager-ui","success_count":3,"unavailable_count":0},{"category":"object-read","receiver_role":"provider","reconciliation":"fixed-available","rejected_count":0,"request_body_bytes":0,"request_count":7,"response_body_bytes":21093,"sender_role":"storage-gateway","success_count":6,"unavailable_count":1}],"evidence_profile_id":"LOCUS-managed-flow-evidence-profile-v1","expected_absences":{"browser-to-service":true,"client-to-manager":true,"client-to-provider":true,"manager-to-client-container":true,"ui-to-docker":true,"unknown-edge-or-category":true},"format_id":"LOCUS-managed-flow-result-appss-v1","limitations":["same-host single-operator observation only","application-boundary aggregates are not packet capture","counts do not establish cryptographic proof","no latency throughput or resilience metric is reported","managed UI does not expose successor lifecycle operations"],"metrics":{"contact_categories":25,"reconciliation_failures":0},"output_safety":{"prohibited_findings":0,"scan":"passed"},"positive_controls":{"allowed_edge_observed":true,"blocked_isolation_probes":true,"byte_bound_detected":true,"client_controller_success":true,"fabricated_noresolver_detected":true,"fictional_marker_detected":true,"manager_controller_success":true,"mismatch_detected":true,"raw_events_discarded":true,"sequence_gap_detected":true,"service_logs_discarded":true,"unknown_category_detected":true,"unknown_role_detected":true},"scenario_contracts":["C11","C12","C13"],"scenario_id":"NF06","scenario_manifest_sha256":"cf6f329383a5324c96a6274deaea783f2461843fd946367892cb8c203340fe0d","status":"passed","trace_policy_id":"LOCUS-managed-flow-trace-policy-v1"}
